Date	Name	Source	Tweets	TweetCount	SusDomainTweets	SusUserTweets	PeakIQR
20220321	Josh Shapiro	SusDomain	TOMORROW, 7PM EDT:campaign mgr&amp; PA AG &amp; Democratic candidate fordiscuss his platform from theperspective!Register via the link and see you tomorrow!; It’s not a sham.There’s plenty of evidence to support the claim.; It’s not a sham.There’s plenty of evidence to support the claim.; Heyand; Here’s proof we had cheating in PA voting yet you refused to even investigate.And you even brag about stopping lawsuits looking into this.If you can’t be trusted to do your job as AG why would anyone want to vote for you for Governor?	2157.0	12.0	37.0	4.0
20220321	Matt Salmon	SusDomain	Biden Just Set Another Worst-Ever Record At Border — And He's Guaranteeing Crisis Will Growvia…; This is a BIG win for parents across Arizona.I was proud to endorse Senate Bill 1211 (and I u…	28.0	4.0	5.0	4.0
20220321	Sarah Huckabee Sanders	SusDomain	"No one talks about 'socialism -The 'uneducated' are telling you that all democratic-socialism/'leftist' is exactly the same as COMMUNISM/Marxism! (It is Not!)Tick off the 'liberal' programs to delete:; No one talks about 'socialism -The 'uneducated' are telling you that all democratic-socialism/'leftist' is exactly the same as COMMUNISM/Marxism! (It is Not!)Tick off the 'liberal' programs to delete:; A VITAL WARNING AND CALL TO CHRISTIANS ABOUT ""The New World Order"" via ""The Great Reset"" by Archbishop Vigano; Sarah Huckabee Sanders has just 33 words for the largest mass shooting this year that just happened in her state; Sarah Huckabee Sanders has just 33 words for the largest mass shooting this yearis IMBICILL uncaring so called Christian who wants to govern Arkansas wise up people she's not qualified barely human 😤; No one talks about 'socialism -The 'uneducated' are telling you that all democratic-socialism/'leftist' is exactly the same as COMMUNISM/Marxism! (It is Not!)Tick off the 'liberal' programs to delete:; Sarah Huckabee Sanders has just 33 words for the largest mass shooting this year that just happened in her state"	3847.0	9.0	5.0	1.5
20220322	Charlie Crist	SusDomain	Wake up; Naked Hunter Biden tells prostitute Russians stole another laptopvia; Woke is an infiltration of lies and the people who make these movements have chaos and organized Khazarian Mafia for closet leaders where have you been Crist and Fried your backed by one of the worst on the planets Soros.; You sure? Do they have law classes in the 5th grade?; Woke is an infiltration of lies and the people who make these movements have chaos and organized Khazarian Mafia for closet leaders where have you been Crist and Fried your backed by one of the worst on the planets Soros.; Naked Hunter Biden tells prostitute Russians stole another laptopvia	11709.0	8.0	23.0	1.5
20220322	Kathy Hochul	SusDomain	You haven't fought back against those smearing feces on our faces tho. Why?; Enough units to house all NYC’s homeless are sitting vacant: survey .....stop this madness…; Enough units to house all NYC’s homeless are sitting vacant: survey .....stop this madness; You haven't fought back against those smearing feces on our faces tho. Why?; You haven't fought back against those smearing feces on our faces tho. Why?; You haven't fought back against those smearing feces on our faces tho. Why?	538.0	10.0	8.0	3.0
20220323	Jumaane Williams	SusDomain	"What about this case? I believe assault especially on minors should be automatic bail.; What about this case? I believe assault especially on minors should be automatic bail.;  ,,,,,: Unacceptable: the policies of ""progressive"" ideologues likeBragg,,,,promote crime.via; Join' virtual panel onwhich provides access to a college education for incarcerated people. The discussion is moderated by&amp; features,,, &amp;. RSVP:; What about this case? I believe assault especially on minors should be automatic bail.; Leave it to theto try to paintas a hypocrite. This is absurd."	326.0	6.0	9.0	1.5
20220324	Henry McMaster	SusDomain	Henry McMaster why are 1800 UNTESTED RAPE kits in SC; Henry McMaster why are 1800 UNTESTED RAPE kits in SC	188.0	6.0	1.0	4.0
20220324	Kristi L. Noem	SusDomain	The Truth About Gun Violence By The NumbersWatch The Full Video Here:; The Internet, Crypto, Bitcoin, and Now NFT's...The Next BIG Thing! NFT's are just the start and technology behind them is here to stay, why not learn from the experts that already made money from flipping NFTs and that are already in the NFT space.; W/ BIDEN N DEMS' CRIME WAVE/CRIMINALS FIRST VICTIMS LAST-INSANITY, n biden's nomination of a far left-activist to the sc, who is weak on criminals/crime, our 2nd amend right is our lifeline.; The Internet, Crypto, Bitcoin, and Now NFT's...The Next BIG Thing! NFT's are just the start and technology behind them is here to stay, why not learn from the experts that already made money from flipping NFTs and that are already in the NFT space.; Have you ever thought about the money you can save on taxes by simply starting a part-time opportunity ...! Fill in the form below...; The Truth About Gun Violence By The NumbersWatch The Full Video Here:	1874.0	6.0	5.0	1.5
20220325	David Perdue	SusDomain	What happened toin theUS Senate race! Did Abrams take credit 4 these teens work? They registered more than 65,000 students nationally for 2020 Pres elect &amp; 17,000 students in GA by sharing their website in college email threads.	331.0	4.0	3.0	1.5
20220325	Josh Shapiro	SusDomain	Breaking Gun Laws to Oppose Gun Laws! YOU ARE NOT ABOVE THE LAW JOSH; Just for reference, here is an AG who does their job, shows up, and doesn't bad mouth other states. BTW he is from ALABAMA!; As josh shapiro and Atty Gen agents pander/clammer over ghost guns and gun laws-did they themselves violate state and federal gun laws for votes? Possibly so.The courts will decide. REMEMBER NOVEMBER HELL NO SHAPIRO; As josh shapiro and Atty Gen agents pander/clammer over ghost guns and gun laws-did they themselves violate state and federal gun laws for votes? Possibly so.The courts will decide. REMEMBER NOVEMBER HELL NO SHAPIRO; How about securing our Borders!; As josh shapiro and Atty Gen agents pander/clammer over ghost guns and gun laws-did they themselves violate state and federal gun laws for votes? Possibly so.The courts will decide. REMEMBER NOVEMBER HELL NO SHAPIRO	2442.0	7.0	35.0	1.5
20220326	Jumaane Williams	SusDomain	it's all the money not the health of the people. Adams admits ex-Council Speaker Corey Johnson lobbied for Nets on athlete vaccine exemptionvia; Facts and fear. Kids are getting shot, and you and other progressives continue to believe we should be more concerned about protecting inmates and suspects of violent crime.; Facts and fear. Kids are getting shot, and you and other progressives continue to believe we should be more concerned about protecting inmates and suspects of violent crime.; No one cares Criminal Advocate. Focus on the mess you've created.; Eric Adams considering using drones to fight NYC crime, sources sayvia; No one cares Criminal Advocate. Focus on the mess you've created.	222.0	6.0	9.0	1.5
20220327	Rebecca Kleefisch	SusDomain	The latest example of liberal big tech censorship.keep up the fight!; The latest example of liberal big tech censorship.keep up the fight!	908.0	15.0	4.0	4.0
20220328	Brian Dahle	SusDomain	Californians are tired of the waste and mismanagement of our state’s natural resources. So am I.	11.0	7.0	1.0	4.0
20220329	Brad Little	SusDomain	"is a communist globalist. People need to be reminded that it's still illegal to medically discriminate or force people to take shots of ANY kind and that there have been no laws to enforce any of this COVID bullshit. Vote Little OUT!; Like a child molester, people likehas groomed Idaho businesses into following whatever CDC says - freedom and science be darned. Now he turns around and says its ""limited government"" to let them discriminate based on those mandates he did; .locked down his state (despite his denial), arrested church choirs and moms and playgrounds, shut ""non essential business,"" and then now claims to oppose prohibition on vaxx mandates because he is for ""limited government""; .locked down his state (despite his denial), arrested church choirs and moms and playgrounds, shut ""non essential business,"" and then now claims to oppose prohibition on vaxx mandates because he is for ""limited government""; What the hell is wrong with u? U represent RED Idaho. .locked down his state, arrested church choirs &amp; moms, shut down playgrounds &amp; ""non essential business,"" he opposes prohibition on vaxx mandates because he is for ""limited government""; To this day, there is an Idaho woman with pending charges against her for simply bringing her kid to a park during's lockdown. Idaho is a red state with a blue management team.; What the hell is wrong with u? U represent RED Idaho. .locked down his state, arrested church choirs &amp; moms, shut down playgrounds &amp; ""non essential business,"" he opposes prohibition on vaxx mandates because he is for ""limited government""; is a communist globalist. People need to be reminded that it's still illegal to medically discriminate or force people to take shots of ANY kind and that there have been no laws to enforce any of this COVID bullshit. Vote Little OUT!"	314.0	16.0	3.0	4.0
20220329	David Perdue	SusDomain	DOES GA., NEED A LYING GOV? AFTER HAVING A LYING MAN IN THE WH FOR 4YRS. Jared Kushner ‘privately admitted’ his father-in-law’s election lies were bogus: Kushner privately admitted that a lot of what Trump’s lawyers were pushing was a fraud and farce.; Judge's 'very declarative' statement about Trump's criminality is 'a big deal': NYT's Haberman The judge's ruling, which argued that Trump very likely knew his scheme to overturn the 2020 election was illegal.; Judge's damning ruling on Trump will 'reverberate throughout the office' at the DOJ: Ex-FBI official A federal judge issued a ruling stating that former President Donald Trump likely committed a felony.; Judge's 'very declarative' statement about Trump's criminality is 'a big deal': NYT's Haberman The judge's ruling, which argued that Trump very likely knew his scheme to overturn the 2020 election was illegal.; Judge's damning ruling on Trump will 'reverberate throughout the office' at the DOJ: Ex-FBI official A federal judge issued a ruling stating that former President Donald Trump likely committed a felony.; The disturbing link between Ginni Thomas and the right-wing People's Convoy	631.0	6.0	18.0	1.5
20220329	J.B. Pritzker	SusDomain	We know exactly who you are.; Your family is making huge profits on making people think they were born in the wrong body.	895.0	4.0	6.0	3.0
20220330	Kathy Hochul	SusDomain	"Blame New York polsfor the city's high jobless ratevia; And Albany political hacks(D-NY)maintain their hard pro-crime line in favor of the Bail Elimination Act (""bail reform""). 🔫🗡🪓; CORRUPTION!!!; And Albany political hacks(D-NY)maintain their hard pro-crime line in favor of the Bail Elimination Act (""bail reform""). 🔫🗡🪓; Blame New York polsfor the city's high jobless ratevia"	3261.0	8.0	21.0	1.5
20220331	Janet T. Mills	SusDomain	.sayshas emerged from theas a desirable place to live.reports; Gov. Mills says Maine economy is on the right trackInvestments in job creation, high-speed internet and an influx of new residents are setting the state up for future growth,said.	88.0	2.0	3.0	1.5
20220331	Josh Shapiro	SusDomain	"lol! Yeah! the 𝕞are fine!!! No election fraud !!!Your favorite Dems on camera insisting the machines are being hacked :; WOW! PA Election Observer Drops BOMBSHELL – Says DOJ Showed Up at Her Door to Question Her After She Testified (VIDEO)Web Archive:; "" However, combining the samples produces significant results and implies at least 10,000 additional votes for Biden in Pennsylvania’s Allegheny and Georgia’s Fulton counties.""; “Baggies of USBs” – PA Witness Gives Explosive Testimony: I Personally Observed USB Cards Being Uploaded to Voting Machines – Now ’47 USB Cards are Missing, Nowhere...Decentralized PDF Archive:Web Archive:; Pennsylvania Judge Files Memorandum Stating 2020 PA Election Likely Unconstitutional – Trump Case “Likelihood to Succeed” – Gives State Legislators Power to Choose Electors!Web Archive:; WOW! PA Election Observer Drops BOMBSHELL – Says DOJ Showed Up at Her Door to Question Her After She Testified (VIDEO)Web Archive:; lol! Yeah! the 𝕞are fine!!! No election fraud !!!Your favorite Dems on camera insisting the machines are being hacked :; Fuck junk Shapiro.; EXCLUSIVE: USB DRIVES Were Suspiciously Stolen, Transferred and Inserted Into Voting Systems Used in Swing States in 2020 Election Georgia GA WI PA MI AZDecentralized PDF Archive:Web Archive:; WOW! PA Election Observer Drops BOMBSHELL – Says DOJ Showed Up at Her Door to Question Her After She Testified (VIDEO)Web Archive:"	5680.0	13.0	54.0	4.0
20220331	Katie Hobbs	SusDomain	Good morning Katie.; Keep an eye 👁 n her and mad family.; Your tweet was quoted in an article by Post; Heyhow you doing?Remember, Treason doesn't pay well in the end.; Guess you cant run for governor anymore lmao; Keep an eye 👁 n her and mad family.; Your tweet was quoted in an article by Post; Your tweet was quoted in an article by Post; Up yours Hobbs! You liberal shitbird.; 👀	1723.0	15.0	20.0	4.0
20220331	Kevin Stitt	SusDomain	"Bishop accompanied Peters to the Lindell event and also spoke from the stage. “In Colorado, we are a red state,” she told the gathering, though by any conceivable objective measure the state is solidly blue.; Oklahomahas signed a bill into law saving girls and women’s sports in the Sooner State.; They have XY bodies.To all the woke clowns, how’d it work out in Connecticut???; Oklahomahas signed a bill into law saving girls and women’s sports in the Sooner State.; ""told Carlson that 'literally half our state' was now off bounds to state law enforcement thanks to the July 2020 ruling, which he said was causing a surge in crime.""; They have XY bodies.To all the woke clowns, how’d it work out in Connecticut???; Embattled Mesa County clerk Tina Peters appears with militia supporters in video call that included endorsement of violence; Your tweet was quoted in an article by humanevents; ""told Carlson that 'literally half our state' was now off bounds to state law enforcement thanks to the July 2020 ruling, which he said was causing a surge in crime.""; ""told Carlson that 'literally half our state' was now off bounds to state law enforcement thanks to the July 2020 ruling, which he said was causing a surge in crime."""	4975.0	164.0	7.0	4.0
20220331	Steve Sisolak	SusDomain	BREAKING: Building upon his work to reduce air pollution from transportation,just committed Nevada to a multi-state agreement to transition large delivery vans, garbage trucks, buses, big rigs, and more toby 2050!1/6; Underserved communities are more likely to be located near highways and facilities that are major sources of pollution from freight trucks, delivery vans, buses, &amp; more. That’s why today’sannouncement fromis so important! 👇; BREAKING: Building upon his work to reduce air pollution from transportation,just committed Nevada to a multi-state agreement to transition large delivery vans, garbage trucks, buses, big rigs, and more toby 2050!1/6; Communities of color &amp; low-income communities are more likely to live near roads &amp; highways—major sources of toxic pollution. Thank youfor taking action to electrify trucks &amp; buses to reduce emissions and clean up our air.; Communities of color &amp; low-income communities are more likely to live near roads &amp; highways—major sources of toxic pollution. Thank youfor taking action to electrify trucks &amp; buses to reduce emissions and clean up our air.; BREAKING:continues to lead the charge forby joining 16 other states in an agreement to bring more clean and zero-emission trucks, vans, &amp; buses to our state! Learn more about👇; Underserved communities are more likely to be located near highways and facilities that are major sources of pollution from freight trucks, delivery vans, buses, &amp; more. That’s why today’sannouncement fromis so important! 👇; BREAKING: Building upon his work to reduce air pollution from transportation,just committed Nevada to a multi-state agreement to transition large delivery vans, garbage trucks, buses, big rigs, and more toby 2050!1/6	1373.0	8.0	14.0	1.5
20220401	Beto O'Rourke	SusDomain	If a you're interested in gift cards Click the link below...👇🏻👇🏻; GREAT NEWS:only trails Greg Abbott by 2 percentage points for Texas Governor, according to a new Texas Lyceum Poll. Help ushere:; You're asking for a source that isn't looked at enough. And when they are looked at the trans community shuns them, disowns them, and calls them traitors to the point they leave the community all together and aren't found for questioning.; is a total loser. He's an embarrassment. Beto O'Rourke roasted for wearing 'Don't mess with trans kids' shirt: 'Adult men fangirling over trans kids is extremely creepy'; Neo-libs gonna posture and make pretty speeches.; Link 🔗 to get this Shirt; Watch out people, this guy has a sick mind, before and now. Don't be manipulated by him. Protect your young from him. He is evil.; Those teeth need to be messed with bad. John Hopkins former chief of psychiatry said this was a mental illness. Why do we allow this BS?; Watch out people, this guy has a sick mind, before and now. Don't be manipulated by him. Protect your young from him. He is evil.; Those teeth need to be messed with bad. John Hopkins former chief of psychiatry said this was a mental illness. Why do we allow this BS?	23390.0	28.0	48.0	4.0
20220401	Heidi Ganahl	SusDomain	ICYMI:joinsto expand on theeditorial: 'Power to the people - and parents - this November.' She also addresses the recentcontroversy in Florida, and how she plans to fight for Colorado parents as governor.; ICYMI:joinsto expand on theeditorial: 'Power to the people - and parents - this November.' She also addresses the recentcontroversy in Florida, and how she plans to fight for Colorado parents as governor.	44.0	2.0	5.0	4.0
20220401	Richard Michael DeWine	SusDomain	On March 14,signed a bill into law that changes gun carrying restrictions in the state; DEWINE CONCEALED (YET RECORDED) RAPE/ATTEMPTED MURDER:🔥 OHIO MASONIC EXPOSURE:AFFIDAVITS (40 sec upload):	242.0	6.0	3.0	4.0
20220404	Lee Zeldin	SusDomain	3.4 million folks in NYS have diabetes—doesn't care if they're gouged for insulin either. All he cares abt is the photo op w/the Juvenile Diabetes Research Fdn. Classic Zeldin. Check out his votes—they don't lie.; One party Democrat chaos ends whenis elected Governor this November. Poll of New Yorkers show strong momentum for! 🇺🇸🐘👊🏼!; The race for Governor of New York is already looking tight—and it's only April.; does not win even in the polls made by his own party! Pathetic830 people poll is a GOP joke; The race for Governor of New York is already looking tight—and it's only April.; 3.4 million folks in NYS have diabetes—doesn't care if they're gouged for insulin either. All he cares abt is the photo op w/the Juvenile Diabetes Research Fdn. Classic Zeldin. Check out his votes—they don't lie.; One party Democrat chaos ends whenis elected Governor this November. Poll of New Yorkers show strong momentum for! 🇺🇸🐘👊🏼!; 3.4 million folks in NYS have diabetes—doesn't care if they're gouged for insulin either. All he cares abt is the photo op w/the Juvenile Diabetes Research Fdn. Classic Zeldin. Check out his votes—they don't lie.; 3.4 million folks in NYS have diabetes—doesn't care if they're gouged for insulin either. All he cares abt is the photo op w/the Juvenile Diabetes Research Fdn. Classic Zeldin. Check out his votes—they don't lie.; The race for Governor of New York is already looking tight—and it's only April.…	1551.0	117.0	19.0	4.0
20220404	Michelle Lujan Grisham	SusDomain	Are you on? Become a grassroots supporter today and help usin November!	279.0	3.0	5.0	1.5
20220405	Greg Abbott	SusDomain	STOP Execution April 27 Sign the petition urging Governorto stop his execution.It's stories like Melissa's that make me speak so loudly about the death penalty in general and why it should be banned when innocent people are suffering.; STOP Execution April 27 Sign the petition urging Governorto stop his execution.It's stories like Melissa's that make me speak so loudly about the death penalty in general and why it should be banned when innocent people are suffering.; EXCLUSIVE: Leaked DHS Document Reveals Biden’s Mass-Migration Plan Offers ‘Broadscale Release Mechanisms’via; You can follow Tennessee’s lead and get rid of those pesky age requirements. It might not illuminate all rape but it would help.; Cartoon: Abbott about-face; .Melissa Lucio is scheduled to be executed on April 27 for a crime that never occurred. Please grant Ms. Lucio clemency and prevent an irreversible injustice.; You can follow Tennessee’s lead and get rid of those pesky age requirements. It might not illuminate all rape but it would help.; STOP Execution April 27 Sign the petition urging Governorto stop his execution.; Please help. I just called and it’s 4:13 am. As a parent it’s hard to watch every second of a child’s life. So please .Melissa Lucio is scheduled to be executed on April 27 for a crime that never occurred.; STOP Execution April 27 Please sign the petition to urge Governorto stop her execution.It’s stories like Melissa’s that make me speak so loud about the death penalty in general and why it should be banned when innocent people are suffering	5870.0	85.0	42.0	1.5
20220405	Stacey Abrams	SusDomain	"They saw that some of these mules would visit these drop boxes every night. And then go to Stacey Abrams’ headquarters and then go back to the drop boxes..; Yesterday it was revealed that the ballot harvesters always stopped at Stacey's True the Vote office on the way to break the law; EXCLUSIVE: DEMOCRATS IMPLICATED -- Georgia Ballot Traffickers Were Using Democrat Officials' Offices as Stopping Points During Ballot Drop RunsDo you think this will go away? It is not going away; Or maybe they paid her rent.; Speaking of Stacey …; Don't forget JUSTICE.; Don't forget JUSTICE.; ""They saw that some of these mules would visit these drop boxes every night. And then go to Stacey Abrams’ headquarters and then go back to the drop boxes."".; The benefits ofoppression and suffering; The benefits ofoppression and suffering"	3372.0	14.0	50.0	4.0
20220406	Josh Shapiro	SusDomain	Do you and your team normally commit felonious gun crimes?; Potential for Fraud Is Why Mail-In Elections Should Be Dead LetterWhy does JOSH keep pushing vote by mail?You decide; New Videos Capture Pennsylvania Officials Hiding Evidence Of Alleged Election Fraud; Potential for Fraud Is Why Mail-In Elections Should Be Dead LetterWhy does JOSH keep pushing vote by mail?You decide	2542.0	5.0	56.0	1.5
20220406	Matt Salmon	SusDomain	Sickening ...	82.0	2.0	11.0	4.0
20220406	Nikki Fried	SusDomain	Lets look at a few really hard facts about democrat rule&amp; ht…; Lets look at a few really hard facts about democrat rule&amp;&amp;especially those leaders that appear to have true ethical concerns; Lets look at a few really hard facts about democrat rule&amp;; Lets look at a few really hard facts about democrat rule&amp;&amp;especially those leaders that appear to have true ethical concerns	90.0	5.0	10.0	4.0
20220407	Brian Kemp	SusDomain	C'mon Georgia!stopped Senate from confirming House changes to SB89 that has language to unseal GA election ballots &amp; improve chain of custody. Would have allowed counterfeit ballots to be detected &amp; electronic votes verified.; You are crooked and don’t deserve to be Georgia’s governor! I wonder how much the rigged system favors you?; You're not going to last. GA voters see exactly what kind RINO you are.; You are crooked and don’t deserve to be Georgia’s governor! I wonder how much the rigged system favors you?; It would have just been more honorable to drop out of your races.; C'mon Georgia!stopped Senate from confirming House changes to SB89 that has language to unseal GA election ballots &amp; improve chain of custody. Would have allowed counterfeit ballots to be detected &amp; electronic votes verified.; Why did you block this election integrity bill?; Kemp aiding and abetting election cheating again! Primary him out of office.; Loser; These 2 are protecting a criminal voting fraud enterprise. There is NO other reason you would block this.and his Lt. are gone in Nov! The voters lose again. Georgia’s Corrupt Governor Kemp and Lt. Gov. Duncan Block Election Integrity Bill	847.0	19.0	12.0	4.0
20220408	Doug Mastriano	SusDomain	Let's go PA! Republican Voter Registrations Surging in Pennsylvania Ahead of May 17 Primary; The good people of the great state of PA know what to do: Vote forfor Governor!He is the leader Pennsylvania needs!Republican Voter Registrations Surging in Pennsylvania Ahead of May 17 Primary; The good people of the great state of PA know what to do: Vote forfor Governor!He is the leader Pennsylvania needs!Republican Voter Registrations Surging in Pennsylvania Ahead of May 17 Primary; Let's go PA! Republican Voter Registrations Surging in Pennsylvania Ahead of May 17 Primary…	295.0	6.0	28.0	4.0
