Date	Name	Source	Tweets	TweetCount	SusDomainTweets	SusUserTweets	PeakIQR
20220408	Joy Hofmeister	SusDomain	8th Grade Science Teacher Tamarah Danzy Wins $25,000 National Milken Educator Award:; 8th Grade Science Teacher Tamarah Danzy Wins $25,000 National Milken Educator Award:; 8th Grade Science Teacher Tamarah Danzy Wins $25,000 National Milken Educator Award:; 8th Grade Science Teacher Tamarah Danzy Wins $25,000 National Milken Educator Award:…	82.0	9.0	5.0	4.0
20220408	Lee Zeldin	SusDomain	"One party chaos ends when⁩is elected Governor this November.; One party chaos ends when⁩is elected Governor this November.; Except could’ve happened long ago if it weren’t for Biden Remembering the Black woman Biden blocked from the Supreme Court | American Enterprise Institute - AEI;  ,,,,,,,: As a NYC Democrat, I'm FED UP with the ideology-driven policies of a ""progressive"" machine that's hijacked my party. ENOUGH!via; Except could’ve happened long ago if it weren’t for Biden Remembering the Black woman Biden blocked from the Supreme Court | American Enterprise Institute - AEI; it's getting CLOSER every day these TYRANTS won't be able to walk the streets there's more of us than there are them!; Except could’ve happened long ago if it weren’t for Biden Remembering the Black woman Biden blocked from the Supreme Court | American Enterprise Institute - AEI;  ,,,,,,: We need more than ""changes,"": we need the ELIMINATION of failed ""progressive"" policies that have legitimized violent crime.via; Biden said he picked her cause she’s black! He also picker her cause she goes easy on Pedos like him &amp; his son! Ketanji Brown Jackson’s Record on Sex Offenses"	3321.0	9.0	18.0	1.5
20220408	Ned Lamont	SusDomain	Coming to a CT nursing home near you...; Coming to a CT nursing home near you...; Well of course Ned Lamont would support this; Insurers and their middlemen determine what patients pay for medicine and are making a profit. Let’s find solutions that help patients, not middlemen. Opposeand supportto medicines and innovation....; Well of course Ned Lamont would support this	1566.0	7.0	12.0	1.5
20220408	Tina Kotek	SusDomain	Yes. Here is the Oregon Tina has created. Big things!	250.0	6.0	4.0	4.0
20220409	Delilah Barrios	SusDomain	Al-Rahma Charity Association is a well-known trusted organization in the Gaza Strip, show your solidarity with our just cause, support our activities, or buy from our store🔥(free shipping🔥)	58.0	2.0	8.0	4.0
20220410	Charlie Crist	SusDomain	Republican “family values”.; For all of you that just are not sure what to do when voting for Governor - They get report cards too!rocked it withI guess whenare telling their tales, means they must not have done their homework!; Rep. Massie: Dems could lable Mothers Could Be 'Domestic Terrorists' for Refusing Corporate Vaccines |via; For all of you that just are not sure what to do when voting for Governor - They get report cards too!rocked it withI guess whenare telling their tales, means they must not have done their homework!; God help the USA if Ron DeSantis becomes elected president in 2024; Rep. Massie: Dems could lable Mothers Could Be 'Domestic Terrorists' for Refusing Corporate Vaccines |via; Rep. Massie: Dems could lable Mothers Could Be 'Domestic Terrorists' for Refusing Corporate Vaccines |via; For all of you that just are not sure what to do when voting for Governor - They get report cards too!rocked it withI guess whenare telling their tales, means they must not have done their homework!	1820.0	13.0	30.0	4.0
20220411	Brian Kemp	SusDomain	"Why are you covering up organized election crime?; Brian Kemp's Lackey and GBI Director Vic Reynolds Leaked Private Info of Brave Election Integrity Activists to Liberal Media - True the Vote Threatens Legal Actionvia; Why are you covering up organized election crime?; We aren’t fired up to election this crook!; andare corrupt. bury TrueTheVote. Flashback: Never Forget - Brian Kemp and GBI Director Vic Reynolds Leaked Serious Confidential Info to Public on True the Vote's Ballot Trafficking Investigationvia; Corruption at the highest levels!; Flashback: Never Forget - Brian Kemp and GBI Director Vic Reynolds Leaked Serious Confidential Info to Public on True the Vote's Ballot Trafficking Investigationvia; MUST SEE: Engelbrecht and Phillips on the Charlie Kirk Show on 2020 Fraud and ""2000 Mules"" - Cross-State Ballot Traffickers ID'ed -Implicated - 1155 Ballot Traffickers in PA (VIDEO) 🆘🆘🆘🆘🆘🆘🆘🆘🆘🆘🆘; Just a complete crook!; Flashback: Never Forget - Brian Kemp and GBI Director Vic Reynolds Leaked Serious Confidential Info to Public on True the Vote's Ballot Trafficking Investigationvia"	333.0	21.0	5.0	4.0
20220411	Josh Shapiro	SusDomain	An inebriated 😵‍💫has AN ANNOUNCEMENT akin to this:; IT IS time to take out THE TRASH! Be suregoes last, so she can eat the dirt of others scum!Why are these five Senate Democrats working with Republicans to block the Biden admin on Title 42?; When are you starting indictments and prosecution on now proven felony shenanigans and willful felony destruction of election voting machine tapes in Delaware county?DO YOUR JOB!!!!; The Secure Fence Act of 2006 isn’t just about fences — it mandates thatprevent all illegal entries. Dementiaignoring it.; IT IS time to take out THE TRASH! Be suregoes last, so she can eat the dirt of others scum!Why are these five Senate Democrats working with Republicans to block the Biden admin on Title 42?; When are you starting indictments and prosecution on now proven felony shenanigans and willful felony destruction of election voting machine tapes in Delaware county?DO YOUR JOB!!!!; The Secure Fence Act of 2006 isn’t just about fences — it mandates thatprevent all illegal entries. Dementiaignoring it.; Still can't stop cheating.	3792.0	8.0	100.0	3.0
20220411	Matt Salmon	SusDomain	My new op-ed with former Maricopa County Sheriff Joe Arpaio →	49.0	4.0	4.0	4.0
20220411	Ned Lamont	SusDomain	"is tomorrow! 🎉 Join hundreds of your fellow business leaders into connect and share your concerns and challenges with state legislators and! Register now:; Connecticut policies fail again!Florida policies succeed again!Why is CT STUBBORNLY not mimicking WIDE RANGING policy successes in Florida?Connecticut is not ""Different""Connecticut is not ""Special""; is tomorrow! 🎉 Join hundreds of your fellow business leaders into connect and share your concerns and challenges with state legislators and! Register now:; So Connecticut'sgot a D for his mismanagement of the state the last two years and NJ got an F- 🥴 New York just a regular F 😵‍💫; . 's CT gets a D grade...We can do better than Ned.; Steve you should seriously move. Remember when you told me Desantis was a moron and Everyone in Florida would die? Ya you were spot on there too. Please put a mask on. I worry about you; So Connecticut'sgot a D for his mismanagement of the state the last two years and NJ got an F- 🥴 New York just a regular F 😵‍💫"	696.0	23.0	11.0	4.0
20220411	Rob Astorino	SusDomain	Is it ok if I am more concerned with our southern border being invaded by millions who have covid, are not required to be vaxxed and are bringing in child rape, criminality and fetanyl than Ukraine? Or am I a putin stooge?; Astorino Says Secret Biden Flights From Southern Border Back At NY Airport	973.0	2.0	6.0	4.0
20220412	Bob Stefanowski	SusDomain	This pandemic &amp; how each state handled it, affected every person. If you are undecided on how to vote in November, then this study should convince you to vote Republican. Connecticut received a D!!; This pandemic &amp; how each state handled it, affected every person. If you are undecided on how to vote in November, then this study should convince you to vote Republican. Connecticut received a D!!	343.0	2.0	6.0	4.0
20220412	Charlie Crist	SusDomain	"Troll better.; We can thank illegitimate current administration Soros, Obama and Soros words ""My lifelong dream is to see the destruction of the U.S"" will be seen as real. 81 days will show us what your globalist party has done to destroy our Country.; This picture should maje every American cringe…this is what Crist’s supports…CHILD ABUSE…all about her!; Here's whywill win his reelection bid by a landslide. Florida ranks in the top 5, overall. His out-of-touch opposition, sorryand persnickety, have ill-advisedly criticized his pandemic response.via; This picture should maje every American cringe…this is what Crist’s supports…CHILD ABUSE…all about her!; Troll better."	12199.0	7.0	22.0	1.5
20220412	Janet T. Mills	SusDomain	“With Maine people grappling with inflation she does not believe it is appropriate to increase costs for car inspections,” saidspokeswoman Lindsay Crete in an email a day after the House voted in favor of the fee increase.; GREAT NEWS! The bill (LD 1639) that closes Maine's out-of-state waste loophole is going to the Governor's desk! Even better, spokesperson forhas indicated that she will sign it!; Maine Legislature sent a bill tothat will help prevent unplanned pregnancies by expanding women’s access to contraception. TYin the Senate &amp;in the House &amp; those who helped the effort.	94.0	3.0	3.0	4.0
20220412	Kathy Hochul	SusDomain	"REPOCitizens to buy Medicaid for illegal migrants in Communist governor$220B budget; REPOCitizens to buy Medicaid for illegal migrants in Communist governor$220B budget; GOOD RIDDANCE!!!!!; You’re just another liberal socialist.; REPOCitizens to buy Medicaid for illegal migrants in Communist governor$220B budget; in 2021: ""[i]t will be somebody who is no stranger to me, but also someone that will carry on the vision of my administration…” New York Lt. Gov. Brian Benjamin resigns after arrest in campaign finance schemevia; following brilliantly in the steps of NY pols. Bravo, babe, bravo. New York Lt. Gov. Brian Benjamin arrested in campaign finance schemevia; REPOCitizens to buy Medicaid for illegal migrants in Communist governor$220B budget; Who needs news of violence in the Ukraine or Mogadishu when we have a plethora of “blue” USrun cities to offer up all the headlines of carnage needed"	1249.0	9.0	5.0	1.5
20220412	Kevin Stitt	SusDomain	"Oklahoma'ssigned a bill today making it a felony to perform an abortion in the state. The bill passed the house in April with strong support. It will go into effect this summer unless blocked by courts.at: ; Thank youfor signing the bill to ban abortions!; Thank youfor signing the bill to ban abortions!; “We want Oklahoma to be the most pro-life state in the country.""Oklahomasigns new pro-life bill into law, enacting some of the strongest protections for the unborn and their mothers in the nation.; “We want Oklahoma to be the most pro-life state in the country.""Oklahomasigns new pro-life bill into law, enacting some of the strongest protections for the unborn and their mothers in the nation."	6597.0	39.0	16.0	4.0
20220412	Lee Zeldin	SusDomain	You better worry about Colorado and not New York. The GOP there is primarying you. You aren't liked in your own state. You are already in the trash heap; Has not passed a single bill Since her term began, Boebert has failed to sponsor any successful legislation. In fact, her sponsored work has yet to even pass through a single committee.; Imagine the worst of the worst of the worst being held (because there is only room for 825 max per borough). Building a jail specifically in a place with excellent transportation OUT of the jail to JFK &amp; a residential area - what could go wrong? ROLFMAO.; Imagine the worst of the worst of the worst being held (because there is only room for 825 max per borough). Building a jail specifically in a place with excellent transportation OUT of the jail to JFK &amp; a residential area - what could go wrong? ROLFMAO.; Embattled Mesa County clerk Tina Peters appears with militia supporters in video call that included endorsement of violence; Broke federal campaign law Adding to a long rap sheet, Boebert is now under investigation by the Federal Election Commission for breaking federal campaign law; Has not passed a single bill Since her term began, Boebert has failed to sponsor any successful legislation. In fact, her sponsored work has yet to even pass through a single committee.; Lauren Boebert Embarrasses Herself While Trying To Discuss Fentanyl; Broke federal campaign law Adding to a long rap sheet, Boebert is now under investigation by the Federal Election Commission for breaking federal campaign law; The DemoRats roll back pension reform,Holchul'$ give-away to the Buffalo Bills, no substantive criminal reform, now .. NYers buy Medicaid for illegal migrants in Gov. Hochul, Dems’ $220B budget!	2189.0	20.0	20.0	4.0
20220412	Stacey Abrams	SusDomain	Lara Hodgson joinson REfresh TOMORROW to talk about her newly published book, LEVEL UP, co-authored with, to reveal the unseen tethers that keep us from growing &amp; thriving. April 13th at 12pm on Zoom &amp; Facebook Live. 🔗; FACT: Its Warnock, Ossoff, Dickens and soon Abrams. Democrate run cities:; Pres. can 🛑🏛SCOTUS from decimating! ⏰DEMAND✍🏻22SAVE🔑will🐝basis 4Fundamental Right2🚫Handmaids Hell ☎️📖👇🏼Re🦜; FACT: Its Warnock, Ossoff, Dickens and soon Abrams. Democrate run cities:	2439.0	7.0	49.0	1.5
20220412	Steve Sisolak	SusDomain	Nevada ranked in the bottom 10. Great job,; Nevada ranked in the bottom 10. Great job,; We cannot never be glad about this!🧐😓🤑😳🙄; Nevada ranked in the bottom 10. Great job,; Nevada ranked in the bottom 10. Great job,; We also thank, who after signing AB 93 in 2019, allowed nonprofits like Clean Up the Lake to also receive Lake Tahoe License Plate grants. You can help support other conservation projects atby purchasing your own license plate at; Bring this news to the seniors 🧐😓🤑 ; We cannot never be glad about this!🧐😓🤑😳🙄; “How we transport ourselves and move goods across the U.S. matters for our economy, for our environment, and for the health and well-being of our communities,” says. TY, Gov Sisolak, for being a leader in thetransition.; “How we transport ourselves and move goods across the U.S. matters for our economy, for our environment, and for the health and well-being of our communities,” says. TY, Gov Sisolak, for being a leader in thetransition.	1031.0	11.0	12.0	3.0
20220412	Tony Evers	SusDomain	The lockdowns did NOT work. Not thatEvers cares.	846.0	4.0	13.0	3.0
20220413	Brad Little	SusDomain	Idaho is latest state to join lawsuit to block ending of Title 42via; Idaho Supreme Court Temporarily Blocks Texas-Style Heartbeat Law Banning Abortionsvia	311.0	13.0	5.0	4.0
20220413	Greg Abbott	SusDomain	.Melissa Lucio is scheduled to be executed on April 27 for a crime that never occurred. Please grant Ms. Lucio clemency and prevent an irreversible injustice. Or live with blood on your hands.; Texas Gov. Greg Abbott can't keep teachers safe in their schools. Texas school district moves to a four-day week due to teacher burnout.; How cansleep at night? Pure evil!; .client Melissa Lucio faces execution on April 27, for a crime that never occurred.&amp; the Texas Board of Pardons and Parole must intervene. Call them now: 956-446-2866; Beto says Biden needs to be better prepared before ending Title 42; Yup. While the dumbass right wing praise his humorous attempt at bashing Democrats for open borders,could be charged for every illegal he transports to a blue state and it could cost him his job....which wouldnt be a bad thing.; YOUR RIGHT! It actually saves money. This might help the ignorant ones talking BS at you. Increased population impacts state infrastructure adds to need for state paid cost for this and additional social programs not covered by feds.; 🤔; WIN! WIN! WIN!; Thank this guy	76439.0	108.0	471.0	1.5
20220413	Jumaane Williams	SusDomain	"My brother why...; Not really unclear. This is what happens when you crank out an anti-white agenda and critical race theory 24/7/365 coupled with failing to investigate government fraud like ThriveNYC's missing billions.; doesn'tliterally live on the military base in Brooklyn, a 24/7 secured compound?;  ,,,,,: For 10 years, ""progressives"" like,cut public safety laws and hobbled police. Rising crime is the snowballing result.via;  ,,,,,: This says it all. Blame crime-coddling ideologues like,,,, and of course,.via;  ,,,,,: For 10 years, ""progressives"" like,cut public safety laws and hobbled police. Rising crime is the snowballing result.via; Radical racial divisiveness; doesn'tliterally live on the military base in Brooklyn, a 24/7 secured compound?"	795.0	8.0	14.0	1.5
20220413	Tina Kotek	SusDomain	Your top staffer was arrested at the antifa riots in Portland. Are you antifa as well is this the reason why our state burned to the ground and had riots and murders for over 200 days? Were you a part of antifa are you antifa?; Did you stand for our children here in Oregon when antifa tinas my top staffers and other staff members were burning down Oregon; Housing tinas Antifa staff members; Did you stand for our children here in Oregon when antifa tinas my top staffers and other staff members were burning down Oregon; Did you stand for our children here in Oregon when antifa tinas my top staffers and other staff members were burning down Oregon	271.0	5.0	5.0	4.0
20220414	Andrew Giuliani	SusDomain	Rudy Giuliani is having another normal one	308.0	13.0	10.0	4.0
20220414	Brian Kemp	SusDomain	Trump-backed super PAC misses in attack onand fraud in Georgia elections.; OL'KNOWS what will help him keep his job as Governor in Georgia 🇺🇸😎 Who wants to pay extra money for a piece of paper from the Government?? If we still believe in America we have to keep this right!!; Trump PAC Sends $500,000 to Group Working to Defeat Gov. Kemp in Georgia Primaryvia; Oust Brian Kemp! via	1072.0	9.0	12.0	1.5
20220414	Josh Shapiro	SusDomain	WAKE UP! READ 👇🏽👇🏿👇🏻🧯Only BIDEN can 🛑🏛SCOTUS from incinerating!⏰DEMAND✍🏻NOW22SAVE🔑will🐝basis 4Fundamental Right2☎️📖👇🏼Re🦜; WAKE UP! READ 👇🏽👇🏿👇🏻🧯Only BIDEN can 🛑🏛SCOTUS from incinerating!⏰DEMAND✍🏻NOW22SAVE🔑will🐝basis 4Fundamental Right2☎️📖👇🏼Re🦜; you will see more of these types of prosecutions.; READ THIS👇🏿👇🏻👇🏽 Then☎️🧯Only BIDEN can 🛑🏛SCOTUS from incinerating!⏰All pro-choice protests DEMAND✍🏻NOW22SAVE🔑will🐝basis 4Fundamental Right📖👇🏼Re🦜; WAKE UP! READ 👇🏽👇🏿👇🏻🧯Only BIDEN can 🛑🏛SCOTUS from incinerating!⏰DEMAND✍🏻NOW22SAVE🔑will🐝basis 4Fundamental Right2☎️📖👇🏼Re🦜; If you want more Bidenism in Pennsylvania, then vote for josh shapiro.Otherwise, do the right thing.REMEMBER NOVEMBEROH HELL NO SHAPIROBiden Hits Lowest Approval Ratings Of His Presidency In Two More Polls; no josh,it’s too late to switch parties for YOUR own good. The SS Democratic Party is dead in the water and sinking fast.REMEMBER NOV OH HELL NO SHAPIROMajor Problems For Democrats in 2022	3244.0	8.0	55.0	3.0
20220414	Rebecca Kleefisch	SusDomain	Where’s your shovel?; Make sure to brag about the “eighth wonder of the world”; Where’s your shovel?	694.0	3.0	6.0	1.5
20220415	Katie Hobbs	SusDomain	"Studies show babies feel pain during abortions as early as 12 weeks.; Look at the pictures ⬇️&amp; tell me this is 'healthcare'.How are you to protect the people of AZ if you can't defend life and protect these viable, premature human beings?Aborted babies discovered in DC may indicate infanticide after attempted abortions; No it’s not.; WILL FERRELL, WHAT IS THIS?; No it’s not.; No it’s not.; It is all a circle jerk of money for you, IT IS NOT HEALTH CARE.You prey on uniformed women using emotional heart string tugs like ""my body my choice"" etc, and then when you get the evil (which they regret the rest of their lives)...You turn a profit!; It is all a circle jerk of money for you, IT IS NOT HEALTH CARE.You prey on uniformed women using emotional heart string tugs like ""my body my choice"" etc, and then when you get the evil (which they regret the rest of their lives)...You turn a profit!"	8627.0	9.0	10.0	3.0
20220415	Rob Astorino	SusDomain	NJ women's prison inmates pregnant after sex with transgender prisoner Let me fix this headline Man with penis impregnates two female prisonersvia; NJ women's prison inmates pregnant after sex with transgender prisoner Let me fix this headline Man with penis impregnates two female prisonersvia; Your tweet was quoted in an article by Post	191.0	3.0	5.0	4.0
20220415	Stacey Abrams	SusDomain	You meanhas to abide by the law? Why do libs like her think they can sidestep election laws?; FACT: Its Warnock, Ossoff, Dickens and soon Abrams. Democrate run cities:; FACT: Its Warnock, Ossoff, Dickens and soon Abrams. Democrate run cities:; Judge rejects NUTJOB Stacey Abrams’ 👧🏽 bid for unlimited campaign contributions It’s NOT an all-you-can-eat buffet, Big Stace! There are RULES. Hasconceded the GA race yet? No. No she hasn’t. LOLOLOLvia; FACT: Its Warnock, Ossoff, Dickens and soon Abrams. Democrate run cities:; Judge rejects NUTJOB Stacey Abrams’ 👧🏽 bid for unlimited campaign contributions It’s NOT an all-you-can-eat buffet, Big Stace! There are RULES. Hasconceded the GA race yet? No. No she hasn’t. LOLOLOLvia	3652.0	9.0	24.0	1.5
20220416	Beto O'Rourke	SusDomain	"Why is the Biden administration conspiring to facilitate illegal immigration?👇; ""On that Drive, There Was More than Enough Evidence of Wrongdoing in the Ukraine Under the Previous [Obama] Administration"" - Exclusive with John Paul Mac Isaac - Computer Repairman Who Handled Hunter Biden's Laptopvia; Beto O‘Rourke: Gov. Abbott‘s ‘War on Women‘ Is ‘Very Bad for Texas‘via- IF THAT LIE DOESN’T WORKYOU CAN ALWAYS PLAY THE RACE CARD.; Beto O‘Rourke: Gov. Abbott‘s ‘War on Women‘ Is ‘Very Bad for Texas‘via- IF THAT LIE DOESN’T WORKYOU CAN ALWAYS PLAY THE RACE CARD.; This is also unnecessary 👇; ""Texas child welfare workers are resigning” 💋; READ THIS👇🏿👇🏻👇🏽 Then ☎️🧯Only BIDEN can 🛑🏛SCOTUS from incinerating! ⏰All pro-choice protests DEMAND✍🏻NOW22SAVE🔑will🐝basis 4Fundamental Right 📖👇🏼Re🦜; Why is the Biden administration conspiring to facilitate illegal immigration?👇; This is also unnecessary 👇; READ THIS👇🏿👇🏻👇🏽 Then ☎️🧯Only BIDEN can 🛑🏛SCOTUS from incinerating! ⏰All pro-choice protests DEMAND✍🏻NOW22SAVE🔑will🐝basis 4Fundamental Right 📖👇🏼Re🦜"	34365.0	26.0	253.0	3.0
20220416	Kathy Hochul	SusDomain	Hochul slams Ron DeSantis for 'smiling' while signing into law 15-week abortion banviayou just love seeing people die. You’re a horrible human being. You love when people get shot on the subway and you love murdering kids. RESIGN.; Your tweet was quoted in an article by Post; Queens principal booted for fraud will get nice paycheck for 7 yearsviayou fire people for not getting the vax, but this guy gets to keep his. You people are pathetic.; This money should go to the whistleblowers.; Queens principal booted for fraud will get nice paycheck for 7 yearsviayou fire people for not getting the vax, but this guy gets to keep his. You people are pathetic.; Your tweet was quoted in an article by Post; This money should go to the whistleblowers.; Your tweet was quoted in an article by Post; Queens principal booted for fraud will get nice paycheck for 7 yearsviayou fire people for not getting the vax, but this guy gets to keep his. You people are pathetic.	980.0	9.0	5.0	1.5
20220417	Kevin Stitt	SusDomain	"“If you want people to be disenfranchised, make them all vote by mail,” said J. Christian Adams, a member of the U.S. Commission on Civil Rights. “Ballots get lost, ballots get destroyed, ballots get hidden by postmen.""; 2. Trump was RIGHT not to trust Dr. Fauci or the CDC who both worked WITH the WUHAN LAB on GAIN-OF-FUNCTION testing.His DUTY was to question.; Here's the thing... Islam is several different sects in different countries.Oddly enough, the WORST human rights ABUSES come from the Wahhabi Salafi sect... which, oddly enough was started by the British.; WTF!?!: Oklahoma State University hosts ‘Drag Queen Story Hour’ for kids as young as 2-years-old! ! !!!💀!✊🏼✊🏾✊🦁🌎‼️via; “If you want people to be disenfranchised, make them all vote by mail,” said J. Christian Adams, a member of the U.S. Commission on Civil Rights. “Ballots get lost, ballots get destroyed, ballots get hidden by postmen."""	475.0	6.0	1.0	1.5
